{
  "$schema": "https://raw.githubusercontent.com/line/decaton/v9.1.2/jsonschema/dist/decaton-processor-properties-schema-draft_7.json",
  "decaton.partition.concurrency": 1,
  "decaton.processing.rate.per.partition": -1,
  "decaton.max.pending.records": 1000,
  "decaton.ignore.keys": [ ],
  "decaton.group.rebalance.timeout.ms": 30000,
  "decaton.processing.shutdown.timeout.ms": 30000,
  "decaton.deferred.complete.timeout.ms": 600000,
  "decaton.retry.task.in.legacy.format": true,
  "decaton.legacy.parse.fallback.enabled": true,
  "decaton.client.metrics.micrometer.bound": false,
  "decaton.commit.interval.ms": 1000,
  "decaton.logging.mdc.enabled": true,
  "decaton.per.key.quota.processing.rate": -1,
  "decaton.processor.threads.termination.timeout.ms": 9223372036854775807
}
